{
  "$schema": "../flexshow.schema.json",
  "topology": "single",
  "experience": "vr",
  "completion": "procedural",
  "tier": "4090",
  "gpu": {
    "ai": "auto",
    "render": "auto"
  },
  "processes": {
    "world": {
      "executable": "C:\\Program Files\\Derivative\\TouchDesigner\\bin\\TouchDesigner.exe",
      "project": "../../projects/FlexShow.toe",
      "cwd": "../..",
      "touchdesigner": true
    }
  },
  "transport": {
    "type": "local",
    "atlas_width": 1024,
    "atlas_height": 512,
    "atlas_fps": 10,
    "atlas_port": 12000,
    "control_port": 12001,
    "heartbeat_port": 12002,
    "heartbeat_timeout_ms": 2000
  },
  "runtime_dir": "../runtime/single-4090"
}
