{
  "$schema": "./flexshow.schema.json",
  "topology": "single",
  "experience": "installation",
  "completion": "hybrid",
  "tier": "3080ti_16gb",
  "gpu": {
    "ai": "auto",
    "render": "auto"
  },
  "processes": {
    "world": {
      "executable": "C:\\Program Files\\Derivative\\TouchDesigner\\bin\\TouchDesigner.exe",
      "project": "../projects/FlexShow.toe",
      "cwd": "..",
      "touchdesigner": true
    }
  },
  "transport": {
    "type": "local",
    "atlas_width": 1024,
    "atlas_height": 512,
    "atlas_fps": 5,
    "atlas_port": 12000,
    "control_port": 12001,
    "heartbeat_port": 12002,
    "heartbeat_timeout_ms": 2000
  },
  "runtime_dir": "./runtime/default"
}
